comentario,etiqueta
"Spider-Man es el mejor superhéroe de todos los tiempos",positivo
"Me encanta cómo Tobey Maguire interpretó a Peter Parker",positivo
"Tom Holland es el Spider-Man perfecto para el MCU",positivo
"No me gustó el último traje de Spider-Man en No Way Home",negativo
"Las películas de Andrew Garfield fueron decepcionantes",negativo
"El juego de Spider-Man para PS4 es una obra maestra",positivo
"Zendaya como MJ no me convence del todo",neutral
"El multiverso en No Way Home fue ejecutado perfectamente",positivo
"Los villanos de Spider-Man son los más interesantes del cine",positivo
"Prefiero los cómics clásicos de Spider-Man a las películas nuevas",neutral
"La relación entre Peter y May es conmovedora",positivo
"No entiendo por qué cambiaron el diseño del traje",negativo
"Las escenas de acción son impresionantes",positivo
"El humor de Spider-Man a veces arruina momentos serios",negativo
"El tema musical de Spider-Man es icónico",positivo
"No me gustó cómo manejaron el origen de Spider-Man en Homecoming",negativo
"Miles Morales es una adición fresca al universo Spider-Man",positivo
"Las animaciones de Spider-Verse son revolucionarias",positivo
"El romance entre Peter y Gwen era forzado",negativo
"J.K. Simmons como J. Jonah Jameson es perfecto",positivo
"Spider-Man de Sam Raimi capturó perfectamente la esencia del cómic",positivo
"Kirsten Dunst como Mary Jane fue un casting perfecto",positivo
"El enfrentamiento con el Duende Verde es clásico",positivo
"Spider-Man 2 es una de las mejores películas de superhéroes",positivo
"Spider-Man 3 tuvo demasiados villanos",negativo
"El Amazing Spider-Man reinventó bien el origen",positivo
"Emma Stone y Andrew Garfield tenían química increíble",positivo
"El traje de The Amazing Spider-Man 2 es mi favorito",positivo
"El guión de las películas de Garfield era débil",negativo
"Spider-Man en Civil War fue una introducción perfecta",positivo
"Homecoming mostró un Peter Parker más juvenil",positivo
"Far From Home tuvo unos efectos visuales impresionantes",positivo
"No Way Home fue una obra maestra del fanservice",positivo
"El traje de Iron Spider es demasiado tecnológico",negativo
"Into the Spider-Verse revolucionó la animación",positivo
"Miles Morales es un protagonista refrescante",positivo
"La banda sonora de Spider-Verse es espectacular",positivo
"Spider-Man de PS4 tiene la mejor jugabilidad",positivo
"La historia del juego de Insomniac es cinematográfica",positivo
"Los DLCs del juego fueron algo cortos",negativo
"La historia de 'Kraven's Last Hunt' es oscura y profunda",positivo
"La era de Stan Lee y Steve Ditko es imbatible",positivo
"El arco de 'The Clone Saga' fue demasiado confuso",negativo